{
  "schemaVersion": 1,
  "fromProcessVersion": "0.5.1",
  "toProcessVersion": "0.6.0",
  "sourceProjectDigest": "sha256:0cd422d51a97c810e405acc9543534fbe43adcf4d71864087fb94032417b5d22",
  "targetProjectDigest": "sha256:c36e0d4a64ef0fb597a80af1a42c8e0ad73960e0d6fda1e20b3b964ac928ca2a",
  "project": {
    "schemaVersion": 3,
    "project": "engineering-process",
    "lifecycle": {
      "requiredProfiles": [
        "development",
        "review"
      ]
    },
    "profiles": {
      "development": [
        {
          "id": "unit-and-contract-tests",
          "run": [
            "python",
            "verification/run_test_suite.py"
          ],
          "timeoutSeconds": 1800
        }
      ],
      "review": [
        {
          "id": "portable-skills",
          "run": [
            "python",
            "processctl.py",
            "skills",
            "validate",
            "--root",
            "process_assets/skills"
          ],
          "timeoutSeconds": 300
        },
        {
          "id": "distribution-build",
          "run": [
            "python",
            "verification/verify_distribution.py"
          ],
          "timeoutSeconds": 900
        }
      ]
    },
    "environment": {
      "defaultProfile": "development",
      "foregroundOnly": true,
      "managedTools": [],
      "profiles": {
        "development": [
          "development-runtime",
          "git-runtime",
          "python-runtime"
        ],
        "review": [
          "development-runtime",
          "git-runtime",
          "python-runtime"
        ]
      },
      "requirements": [
        {
          "id": "development-runtime",
          "description": "Exact Python dependencies required by the producer test and build contracts",
          "probe": {
            "run": [
              "python",
              "-c",
              "from importlib.metadata import version; import build, jsonschema, regex; assert version('setuptools') == '84.0.0'; print('producer dependencies ready')"
            ],
            "timeoutSeconds": 15,
            "readOnly": true,
            "outputStream": "stdout",
            "outputRegex": "^producer dependencies ready$"
          },
          "remediation": "Install engineering_process/requirements-runtime.txt, engineering_process/requirements-dev.txt, and engineering_process/requirements-build.txt into the isolated process environment."
        },
        {
          "id": "git-runtime",
          "description": "Git command-line client required for immutable lifecycle checkpoints",
          "probe": {
            "run": [
              "git",
              "--version"
            ],
            "timeoutSeconds": 15,
            "readOnly": true,
            "outputStream": "stdout",
            "outputRegex": "^git version 2\\.[0-9]+\\.[0-9]+"
          },
          "remediation": "Install a supported Git 2.x command-line client."
        },
        {
          "id": "python-runtime",
          "description": "Supported CPython runtime for the producer and lifecycle seed",
          "probe": {
            "run": [
              "python",
              "--version"
            ],
            "timeoutSeconds": 15,
            "readOnly": true,
            "outputStream": "combined",
            "outputRegex": "^Python 3\\.(?:11|12|13|14)\\."
          },
          "remediation": "Install a supported Python 3.11-3.14 runtime."
        }
      ],
      "setupActions": []
    },
    "remoteVerification": {
      "requirements": [
        {
          "id": "supported-python-platforms",
          "profiles": [
            "development",
            "review"
          ],
          "execution": {
            "provider": "github-actions",
            "repository": "phuongnse/engineering-process",
            "workflow": "CI",
            "workflowRef": "phuongnse/engineering-process/.github/workflows/ci.yml@refs/heads/main"
          },
          "selectors": [
            {
              "id": "macos-python-3-14",
              "runnerOs": "macOS",
              "implementation": "CPython",
              "pythonMinor": "3.14"
            },
            {
              "id": "ubuntu-python-3-11",
              "runnerOs": "Linux",
              "implementation": "CPython",
              "pythonMinor": "3.11"
            },
            {
              "id": "ubuntu-python-3-14",
              "runnerOs": "Linux",
              "implementation": "CPython",
              "pythonMinor": "3.14"
            },
            {
              "id": "windows-python-3-14",
              "runnerOs": "Windows",
              "implementation": "CPython",
              "pythonMinor": "3.14"
            }
          ]
        }
      ]
    }
  }
}
