{
  "schemaVersion": 1,
  "fromProcessVersion": "0.1.1",
  "toProcessVersion": "0.2.0",
  "sourceProjectDigest": "sha256:0000000000000000000000000000000000000000000000000000000000000000",
  "targetProjectDigest": "sha256:cdc2c0ff6cf6bea77b6be54f26d8e5926936e46d05ff18e751c10bbd533c986a",
  "project": {
    "schemaVersion": 4,
    "project": "sample-project",
    "lifecycle": {
      "requiredProfiles": [
        "development"
      ]
    },
    "impact": {
      "baseRefs": [
        "origin/main",
        "main"
      ],
      "unmatchedPaths": "all-scoped-checks",
      "components": [
        {
          "id": "source",
          "paths": [
            "**/*.py",
            "pyproject.toml"
          ],
          "affects": []
        }
      ]
    },
    "profiles": {
      "development": [
        {
          "id": "unit",
          "run": [
            "python",
            "-m",
            "unittest"
          ],
          "timeoutSeconds": 600,
          "components": [
            "source"
          ]
        }
      ]
    },
    "environment": {
      "defaultProfile": "development",
      "foregroundOnly": true,
      "managedTools": [],
      "profiles": {
        "development": [
          "python-runtime"
        ]
      },
      "requirements": [
        {
          "id": "python-runtime",
          "description": "Supported CPython runtime",
          "probe": {
            "run": [
              "python",
              "--version"
            ],
            "timeoutSeconds": 15,
            "readOnly": true,
            "outputStream": "combined",
            "outputRegex": "^Python 3\\.(?:11|12|13|14)\\."
          },
          "remediation": "Install a supported Python runtime before running processctl."
        }
      ],
      "setupActions": []
    }
  }
}
